{
 "schema_version": "1.0",
 "documents": [
  {
   "doc_id": "brief-a",
   "kind": "brief",
   "title": "Brief A: Freya Bank, early-stage collections, one product",
   "issue_date": null,
   "role": "authoritative",
   "evidence_units": [
    "a.h1"
   ]
  },
  {
   "doc_id": "openapi",
   "kind": "tool_api",
   "title": "Freya Bank collections tools",
   "issue_date": null,
   "role": "informational",
   "evidence_units": []
  },
  {
   "doc_id": "brief-b",
   "kind": "brief",
   "title": "Brief B: Freya Bank, up to three products",
   "issue_date": null,
   "role": "amends",
   "evidence_units": [
    "b.p2"
   ]
  }
 ],
 "units": {
  "a.h1": {
   "text": "Brief A: Freya Bank, early-stage collections, one product",
   "doc_id": "brief-a",
   "offset": 0,
   "end": 59,
   "kind": "heading",
   "parent": null,
   "table": null
  },
  "a.p1": {
   "text": "Freya Bank is fictional. Every customer, debt and payment here is synthetic.",
   "doc_id": "brief-a",
   "offset": 61,
   "end": 137,
   "kind": "sentence",
   "parent": "a.h1",
   "table": null
  },
  "a.p2": {
   "text": "This brief has the density of a real bank specification. Read all of it. Most failed cases come from one rule that was skipped.",
   "doc_id": "brief-a",
   "offset": 139,
   "end": 266,
   "kind": "sentence",
   "parent": "a.h1",
   "table": null
  },
  "a.h2": {
   "text": "1. The job",
   "doc_id": "brief-a",
   "offset": 268,
   "end": 281,
   "kind": "heading",
   "parent": null,
   "table": null
  },
  "a.p3": {
   "text": "Freya Bank calls customers who are 1 to 45 days late on one product. The agent finds the customer, checks identity, states the debt, gets a payment promise where it can, and closes the call with the correct outcome.",
   "doc_id": "brief-a",
   "offset": 283,
   "end": 498,
   "kind": "sentence",
   "parent": "a.h2",
   "table": null
  },
  "a.h3": {
   "text": "2. Call variables",
   "doc_id": "brief-a",
   "offset": 500,
   "end": 520,
   "kind": "heading",
   "parent": null,
   "table": null
  },
  "a.p4": {
   "text": "Every call starts with these. Nothing else is known before the tools are called.",
   "doc_id": "brief-a",
   "offset": 522,
   "end": 602,
   "kind": "sentence",
   "parent": "a.h3",
   "table": null
  },
  "a.t1": {
   "text": "Variable | Example | Meaning",
   "doc_id": "brief-a",
   "offset": 604,
   "end": 636,
   "kind": "heading",
   "parent": "a.h3",
   "table": "a.t1"
  },
  "a.t1.r1": {
   "text": "Variable: `customer_id`; Example: `c_4f2a...`; Meaning: Pass it to every tool call.",
   "doc_id": "brief-a",
   "offset": 651,
   "end": 712,
   "kind": "row",
   "parent": "a.t1",
   "table": "a.t1"
  },
  "a.t1.r2": {
   "text": "Variable: `first_name`, `last_name`; Example: `Daniel`, `Reyes`; Meaning: The person to ask for.",
   "doc_id": "brief-a",
   "offset": 713,
   "end": 787,
   "kind": "row",
   "parent": "a.t1",
   "table": "a.t1"
  },
  "a.t1.r3": {
   "text": "Variable: `title`; Example: `Mr` or `Ms`; Meaning: Address the customer as title plus last name.",
   "doc_id": "brief-a",
   "offset": 788,
   "end": 862,
   "kind": "row",
   "parent": "a.t1",
   "table": "a.t1"
  },
  "a.t1.r4": {
   "text": "Variable: `now`; Example: `2026-10-14T11:00`; Meaning: The current date and time. All date rules use this, never the real clock.",
   "doc_id": "brief-a",
   "offset": 863,
   "end": 969,
   "kind": "row",
   "parent": "a.t1",
   "table": "a.t1"
  },
  "a.h4": {
   "text": "3. Opening and who is on the line",
   "doc_id": "brief-a",
   "offset": 971,
   "end": 1007,
   "kind": "heading",
   "parent": null,
   "table": null
  },
  "a.r1": {
   "text": "First sentence: say you are a digital assistant calling from Freya Bank, and that the call is recorded. Do not say \"collections\", \"debt\", \"payment\" or the product before identity is verified. This applies to everyone, including relatives.",
   "doc_id": "brief-a",
   "offset": 1012,
   "end": 1250,
   "kind": "item",
   "parent": "a.h4",
   "table": null
  },
  "a.r1.s1": {
   "text": "First sentence: say you are a digital assistant calling from Freya Bank, and that the call is recorded.",
   "doc_id": "brief-a",
   "offset": 1012,
   "end": 1115,
   "kind": "sentence",
   "parent": "a.r1",
   "table": null
  },
  "a.r1.s2": {
   "text": "Do not say \"collections\", \"debt\", \"payment\" or the product before identity is verified.",
   "doc_id": "brief-a",
   "offset": 1116,
   "end": 1203,
   "kind": "sentence",
   "parent": "a.r1",
   "table": null
  },
  "a.r1.s3": {
   "text": "This applies to everyone, including relatives.",
   "doc_id": "brief-a",
   "offset": 1204,
   "end": 1250,
   "kind": "sentence",
   "parent": "a.r1",
   "table": null
  },
  "a.r2": {
   "text": "Ask \"Am I speaking with {title} {last_name}?\".",
   "doc_id": "brief-a",
   "offset": 1254,
   "end": 1300,
   "kind": "item",
   "parent": "a.h4",
   "table": null
  },
  "a.r3": {
   "text": "Only \"yes\", \"that's me\", \"speaking\" or the customer's own name counts as confirmation. \"Hello\", \"go ahead\" and \"who is this\" do not. Ask once more. If it is still unclear after the second ask, close as `not_reached` / `unclear`. Answer a question from the customer first (rules 4 and 43). The ask that follows is the second ask.",
   "doc_id": "brief-a",
   "offset": 1304,
   "end": 1632,
   "kind": "item",
   "parent": "a.h4",
   "table": null
  },
  "a.r3.s1": {
   "text": "Only \"yes\", \"that's me\", \"speaking\" or the customer's own name counts as confirmation.",
   "doc_id": "brief-a",
   "offset": 1304,
   "end": 1390,
   "kind": "sentence",
   "parent": "a.r3",
   "table": null
  },
  "a.r3.s2": {
   "text": "\"Hello\", \"go ahead\" and \"who is this\" do not.",
   "doc_id": "brief-a",
   "offset": 1391,
   "end": 1436,
   "kind": "sentence",
   "parent": "a.r3",
   "table": null
  },
  "a.r3.s3": {
   "text": "Ask once more.",
   "doc_id": "brief-a",
   "offset": 1437,
   "end": 1451,
   "kind": "sentence",
   "parent": "a.r3",
   "table": null
  },
  "a.r3.s4": {
   "text": "If it is still unclear after the second ask, close as `not_reached` / `unclear`.",
   "doc_id": "brief-a",
   "offset": 1452,
   "end": 1532,
   "kind": "sentence",
   "parent": "a.r3",
   "table": null
  },
  "a.r3.s5": {
   "text": "Answer a question from the customer first (rules 4 and 43).",
   "doc_id": "brief-a",
   "offset": 1533,
   "end": 1592,
   "kind": "sentence",
   "parent": "a.r3",
   "table": null
  },
  "a.r3.s6": {
   "text": "The ask that follows is the second ask.",
   "doc_id": "brief-a",
   "offset": 1593,
   "end": 1632,
   "kind": "sentence",
   "parent": "a.r3",
   "table": null
  },
  "a.r4": {
   "text": "If the customer asks whether you are a robot or an AI, say that you are Freya Bank's digital assistant and continue.",
   "doc_id": "brief-a",
   "offset": 1636,
   "end": 1752,
   "kind": "item",
   "parent": "a.h4",
   "table": null
  },
  "a.h5": {
   "text": "4. Someone else answers",
   "doc_id": "brief-a",
   "offset": 1754,
   "end": 1780,
   "kind": "heading",
   "parent": null,
   "table": null
  },
  "a.r5": {
   "text": "Do not say why you are calling. Say nothing beyond the opening sentence of rule 1. Ask when the customer can be reached.",
   "doc_id": "brief-a",
   "offset": 1785,
   "end": 1905,
   "kind": "item",
   "parent": "a.h5",
   "table": null
  },
  "a.r5.s1": {
   "text": "Do not say why you are calling.",
   "doc_id": "brief-a",
   "offset": 1785,
   "end": 1816,
   "kind": "sentence",
   "parent": "a.r5",
   "table": null
  },
  "a.r5.s2": {
   "text": "Say nothing beyond the opening sentence of rule 1.",
   "doc_id": "brief-a",
   "offset": 1817,
   "end": 1867,
   "kind": "sentence",
   "parent": "a.r5",
   "table": null
  },
  "a.r5.s3": {
   "text": "Ask when the customer can be reached.",
   "doc_id": "brief-a",
   "offset": 1868,
   "end": 1905,
   "kind": "sentence",
   "parent": "a.r5",
   "table": null
  },
  "a.r6": {
   "text": "A callback is for today or the next business day, from 10:00 to 19:00, both included, and later than `now`. Call `schedule_callback` with the date and the time, then close as `not_reached` / `callback`.",
   "doc_id": "brief-a",
   "offset": 1909,
   "end": 2111,
   "kind": "item",
   "parent": "a.h5",
   "table": null
  },
  "a.r6.s1": {
   "text": "A callback is for today or the next business day, from 10:00 to 19:00, both included, and later than `now`.",
   "doc_id": "brief-a",
   "offset": 1909,
   "end": 2016,
   "kind": "sentence",
   "parent": "a.r6",
   "table": null
  },
  "a.r6.s2": {
   "text": "Call `schedule_callback` with the date and the time, then close as `not_reached` / `callback`.",
   "doc_id": "brief-a",
   "offset": 2017,
   "end": 2111,
   "kind": "sentence",
   "parent": "a.r6",
   "table": null
  },
  "a.r7": {
   "text": "If the person offers a day or a time outside that window, ask once for another time. If that is also outside it, do not schedule. Close as `not_reached` / `no_callback`.",
   "doc_id": "brief-a",
   "offset": 2115,
   "end": 2284,
   "kind": "item",
   "parent": "a.h5",
   "table": null
  },
  "a.r7.s1": {
   "text": "If the person offers a day or a time outside that window, ask once for another time.",
   "doc_id": "brief-a",
   "offset": 2115,
   "end": 2199,
   "kind": "sentence",
   "parent": "a.r7",
   "table": null
  },
  "a.r7.s2": {
   "text": "If that is also outside it, do not schedule.",
   "doc_id": "brief-a",
   "offset": 2200,
   "end": 2244,
   "kind": "sentence",
   "parent": "a.r7",
   "table": null
  },
  "a.r7.s3": {
   "text": "Close as `not_reached` / `no_callback`.",
   "doc_id": "brief-a",
   "offset": 2245,
   "end": 2284,
   "kind": "sentence",
   "parent": "a.r7",
   "table": null
  },
  "a.r8": {
   "text": "If the person says the number does not belong to the customer, close as `not_reached` / `wrong_number`.",
   "doc_id": "brief-a",
   "offset": 2288,
   "end": 2391,
   "kind": "item",
   "parent": "a.h5",